{
  "schemaVersion": "1.0.0",
  "eventId": "evt_session_001",
  "type": "session.started",
  "timestamp": "2026-02-17T06:00:20Z",
  "payload": {
    "schemaVersion": "1.0.0",
    "sessionId": "sess_123",
    "tenantId": "tenant_abc",
    "status": "started",
    "startedAt": "2026-02-17T06:00:20Z",
    "members": [
      {"id": "ios-user", "role": "viewer"},
      {"id": "android-user", "role": "operator"}
    ]
  }
}
