{
  "schemaVersion": "1.0.0",
  "eventId": "evt_spawn_001",
  "type": "spawn.event",
  "timestamp": "2026-02-17T06:00:00Z",
  "payload": {
    "schemaVersion": "1.0.0",
    "spawnId": "spawn_001",
    "sessionId": "sess_123",
    "parentSpawnId": null,
    "goal": "Plan rollout sequence",
    "depth": 0,
    "status": "running",
    "budget": {
      "maxToolCalls": 25,
      "usedToolCalls": 2
    }
  }
}
